{
  "schema": "fs2-serve.nebius.ai/scientific-scheduler-eligibility-receipt/v1",
  "model_id": "openfold3-openbind",
  "variant_id": "upstream-openbind-v0-5-0",
  "execution_identity_sha256": "147a72f643201cbfaeeba0416481ba4cc48394c306ef84f4b5e23f1ebcec7590",
  "execution_map_sha256": "cafe5eaa551f213a4919b79e3c782da58e381838dee50b984eba32c5004b2e09",
  "acceptance_execution_map_sha256": "cafe5eaa551f213a4919b79e3c782da58e381838dee50b984eba32c5004b2e09",
  "model_execution_map_entry_sha256": "c33154c6c70c176da48038c85464392f679701a1dc1d9125a210cb75e6b3cdf9",
  "public_completion_receipt_sha256": "0ae693f45e04c06f14de8ad7b2c36a09568a11b88bd8c5f57ce2c83046de67db",
  "fleet_aggregate_sha256": "0fcb8b38233467f9ae06fa63c3aebb92be09efdd18ed7dbf3e9e43b04b89d635",
  "acceptance_input": {
    "kind": "secondary-public-acceptance",
    "path": "models/structure/batch-adapters/openfold3/activation/public-acceptance.json",
    "sha256": "fa01cc749681de85ee50f37e104fe9289bae04c2b527faf584c16a18cc8754dd"
  },
  "scheduling_snapshot": {
    "digest": "sha256:6796b89b506cd58af6a8e346d62b607fe6d0ebf8fd55d64020ce053f358552e5",
    "policy_revision": "8117761333018ce7cac0ccf29421960a4945244df396a27e75a67549fc380c9b",
    "captured_at": "2026-09-06T22:42:48.590875Z",
    "service_class": "customer-batch",
    "tenant_queue": "inference-models",
    "model_lane": "openfold3-openbind",
    "stage_decisions": [
      {
        "accelerator_count": 0,
        "accelerator_resource_name": null,
        "checkpoint_mode": "none",
        "max_execution_seconds": null,
        "max_queue_seconds": null,
        "preemption_mode": "restartable",
        "resolved_cluster_queue": "general-cpu",
        "resolved_local_queue": "general-cpu",
        "resolved_pool_preference": [],
        "resource_class": "cpu",
        "stage_id": "data-pipeline",
        "workload_priority_class": "standard",
        "workload_priority_value": 0
      },
      {
        "accelerator_count": 1,
        "accelerator_resource_name": "nvidia.com/gpu",
        "checkpoint_mode": "restart",
        "max_execution_seconds": null,
        "max_queue_seconds": null,
        "preemption_mode": "restartable",
        "resolved_cluster_queue": "inference-accelerators",
        "resolved_local_queue": "inference-models",
        "resolved_pool_preference": [
          "h100-reserved-8x",
          "h100-1x"
        ],
        "resource_class": "gpu",
        "stage_id": "inference",
        "workload_priority_class": "standard",
        "workload_priority_value": 0
      }
    ]
  },
  "successful_admissions": [
    {
      "stage_id": "data-pipeline",
      "shard_id": "main",
      "attempt_number": 1,
      "resolved_pool_id": null,
      "admitted_resource_flavor": null,
      "accelerator_resource_name": null,
      "accelerator_count": 0,
      "admitted_at": "2026-09-06T22:42:48Z"
    },
    {
      "stage_id": "inference",
      "shard_id": "main",
      "attempt_number": 1,
      "resolved_pool_id": "h100-reserved-8x",
      "admitted_resource_flavor": "inference-h100-reserved-8x",
      "accelerator_resource_name": "nvidia.com/gpu",
      "accelerator_count": 1,
      "admitted_at": "2026-09-06T22:52:29Z"
    }
  ],
  "prior_profile_qualified_at": "2026-09-05T06:40:37.632230Z",
  "qualified_at": "2026-09-06T22:53:31.879853Z"
}
